{"vid": "lichen_prinos", "obekt_id": 101, "rayon": "primer-grad-centar", "oblast": "kultura",
 "zaglavie": "Какво прави нашето читалище",
 "tekst": "Читалището има школа по народни танци, детски театрален състав и библиотека. Пише се на info@example.org.",
 "avtor": {"podpis": "ime", "ime": "Примерно Име"}, "uchastie": {"prez": "uchitel"},
 "litsenz": "CC-BY-4.0", "sazdaden": "2026-10-09"}
