{"vid": "lichen_prinos", "obekt_id": 104, "rayon": "primer-grad-centar", "oblast": "sport",
 "zaglavie": "Треньорът на децата",
 "tekst": "Треньорът е много добър, пишете му на ivan.primerov@example.com или звънете на 0888 123 456.",
 "avtor": {"podpis": "psevdonim"}, "uchastie": {"palnoleten": true}, "sazdaden": "2026-10-09"}
